<?xml version="1.0" encoding="UTF-8"?>
<!DOCTYPE DIZ4VX_modell SYSTEM "DIZ4VX_ertodtd.dtd">
<DIZ4VX_modell>
    <A a="a1">
        <b>
            <x></x>
            <y></y>
        </b>
        <b>
            <x></x>
            <y></y>
        </b>
        <c>
            <d></d>
            <e></e>
        </c>
    </A>
    <B a="b1" c="c1">
        <b>
            <x></x>
            <y></y>
        </b>
    </B>
    <C a="c1">
        <b></b>
    </C>
    <AB aref="a1" bref="b1">
        <c></c>
    </AB>
</DIZ4VX_modell>